,Title,Source,Date,Title Sentiment,Body Sentiment,Summary,Link,Body
38,Apple hit by 'bagelgate' as New Yorkers criticize its new bagel emoji,Daily Mail UK,2018-10-08,0.696224,0.404062,"The brouhaha even attracted the Philadelphia Cream Cheese brand, which promised to start a Change.org petition to persuade Apple to introduce a version of the bagel emoji with some schmear. 'If we reach our goal of 30,000 signatures, we will be able to show Apple and the Unicode Consortium that the current dry, sad bagel emoji is unacceptable and needs to be updated to reflect the real thing—a bagel with a schmear of cream cheese,' the brand wrote. It's unclear if Apple will add cream cheese or sesame seeds to its bagel emoji. While Apple and many other tech companies designed their cheeseburger emoji with the cheese on top of the patty, Google faced scrutiny for placing the cheese beneath the burger patty. The burger emoji debate was sparked at the end of October when Thomas Baekdal, an author from Denmark tweeted a screenshot of Apple's and Google's respective cheeseburger emojis showing the different cheese placement.",https://www.dailymail.co.uk/sciencetech/article-6254305/Apple-hit-bagelgate-New-Yorkers-criticize-new-bagel-emoji.html?ns_mchannel=rss&ito=1490&ns_campaign=1490,"First, there was burgergate.

Now, Silicon Valley is reckoning with another emoji apocalypse thanks to Apple's polarizing new bagel, out in iOS 12.1 on iPhones and iPads.

The emoji depicts a plain bagel - no seeds, spread or other toppings, which sent users into an angry frenzy.

Apple's iOS 12.1 became available for users last week, introducing emoji like a lobster, romaine lettuce and a tennis ball alongside the bagel.

It didn't take long for the critics to emerge, as users began to complain that the bagel looked 'stale' or more fit to be from the 'frozen aisle from a supermarket.'

Others said that the bagel's extremely smooth exterior made it appear plastic.

New Yorkers took particular offense to the bagel emoji, with Pat Kiernan, morning news anchor at NY1 News tweeting: 'You call this factory-produced bagel an emoji that stands for all bagels??? New Yorkers demand more.'

The brouhaha even attracted the Philadelphia Cream Cheese brand, which promised to start a Change.org petition to persuade Apple to introduce a version of the bagel emoji with some schmear.

The brand tweeted: 'We think that a #BagelEmoji without cream cheese is a #SadBagel, what do you think?  started a Change.org petition that, by Monday afternoon, had received 1,005 out of 1,500 signatures.

'If we reach our goal of 30,000 signatures, we will be able to show Apple and the Unicode Consortium that the current dry, sad bagel emoji is unacceptable and needs to be updated to reflect the real thing—a bagel with a schmear of cream cheese,' the brand wrote.

Another Twitter user threatened to organize a march in New York City over the bagel gaffe.

It's unclear if Apple will add cream cheese or sesame seeds to its bagel emoji.

But as many have pointed out, emoji go through a formal process before they land on your smartphone.

They're approved by the Unicode Consortium, the body that maintains and publishes standards around emoji.

Those designs are then, typically, adopted by all the tech giants affiliated with it in uniform, like Apple and Google.

Apple also isn't the first tech firm to get caught up in an emoji scandal.

Google faced 'burgergate' last year, which centered around its controversial design of the cheeseburger.

While Apple and many other tech companies designed their cheeseburger emoji with the cheese on top of the patty, Google faced scrutiny for placing the cheese beneath the burger patty.

In response to 'burgergate', Google's CEO Sundar Pichai said he would 'drop everything' to correct this, and now Android's upcoming 8.1 release shows that he was good to his word - the emoji has been corrected.

The burger emoji debate was sparked at the end of October when Thomas Baekdal, an author from Denmark tweeted a screenshot of Apple's and Google's respective cheeseburger emojis showing the different cheese placement.

He wrote: 'I think we need to have a discussion about how Google's burger emoji is placing the cheese underneath the burger, while Apple puts it on top.'

The viral tweet caught the attention of CEO Sundar Pichai, who wrote in response on Sunday: 'Will drop everything else we are doing and address on Monday:) if folks can agree on the correct way to do this!'

The exchange between Pichai and Baekdal garnered social media jokes and suggestions.

Another wrote: 'So proud to work at a company which has it's priorities right.'

'Cheese misplacement is clearly the result of not enough diversity on the emoji team. Damn those vegetarians,' one user joked.

As seen on Emojipedia, Google is the only tech company that offers a cheeseburger emoji with cheese below the patty.

Apple, Facebook, Samsung and others all place the cheese on top."
39,Apple rolls out software update to fix charging issues on iPhone XS,Daily Mail UK,2018-10-09,0.626786,0.724213,"Apple has issued a software update to address the bug that was causing charging issues for some owners of its new iPhone XS and XS Max smartphones. Apple did not comment on the issue at the time, but it was linked to a security feature introduced to stop Apple devices being hacked via USB and the charging port, which disables its connection when the phone has been left idle for a period of time. The notes on the update confirm it “fixes an issue where some iPhone XS devices did not immediately charge when connected to a Lightning cable”. At the time of the security update, which was introduced earlier this year, Apple did acknowledge its introduction could affect charging in some cases, warning users that they might have to unlock their device in order for a connected accessory to be recognised. The update corrects this problem, as well as an issue around WiFi connectivity and a keyboard issue on the iPad, Apple confirmed.",https://www.dailymail.co.uk/wires/pa/article-6256199/Apple-rolls-software-update-fix-charging-issues-iPhone-XS.html?ns_mchannel=rss&ito=1490&ns_campaign=1490,"Apple has issued a software update to address the bug that was causing charging issues for some owners of its new iPhone XS and XS Max smartphones.

Shortly after their release last month, some users reported on social media that devices would not charge when plugged in if the screen was off in “sleep” mode, only doing so when the screen was on.

Apple did not comment on the issue at the time, but it was linked to a security feature introduced to stop Apple devices being hacked via USB and the charging port, which disables its connection when the phone has been left idle for a period of time.

Now the technology giant has released the iOS 12.0.1 software update, which includes a solution to the bug.

The notes on the update confirm it “fixes an issue where some iPhone XS devices did not immediately charge when connected to a Lightning cable”.

At the time of the security update, which was introduced earlier this year, Apple did acknowledge its introduction could affect charging in some cases, warning users that they might have to unlock their device in order for a connected accessory to be recognised.

The update corrects this problem, as well as an issue around WiFi connectivity and a keyboard issue on the iPad, Apple confirmed.

The tech giant is set to release another new iPhone – the iPhone XR – at the end of this month."
40,"Google unveils new Pixel phone, adds tablet in Apple challenge",Daily Mail UK,2018-10-09,0.731206,0.479113,"SAN FRANCISCO, Oct 9 (Reuters) - Alphabet Inc's Google unveiled on Tuesday the third edition of its Pixel smartphone, a Google Home smart speaker with a display and its first tablet computer, as it makes a come-from-behind push into hardware. Pixel phones, though, have been a tougher sell, garnering less than 1 percent of the global market by shipments in Google's first two years of trying, according to research firm Strategy Analytics, and launching with glitches. The Pixel 3, priced at $799, and larger sibling Pixel 3 XL, priced at $899, mark Google's latest entries into a phone lineup it hopes will someday be as popular as Apple Inc's iPhone. Still, the Pixel 3 could see limited uptake in the United States as Google again signed an exclusive distribution deal with wireless carrier Verizon Communications Inc that means the device will get little marketing from other carriers. Google's new smart speaker, which has a display to show visual responses to voice commands, mostly matches offerings from Amazon.com Inc and Facebook Inc.",https://www.dailymail.co.uk/wires/reuters/article-6257851/Google-unveils-new-Pixel-phone-adds-tablet-Apple-challenge.html?ns_mchannel=rss&ito=1490&ns_campaign=1490,"SAN FRANCISCO, Oct 9 (Reuters) - Alphabet Inc's Google unveiled on Tuesday the third edition of its Pixel smartphone, a Google Home smart speaker with a display and its first tablet computer, as it makes a come-from-behind push into hardware.

The company's Android software has gone from being an also-ran to the brains of most of the world's smartphones, and Google topped Amazon.com Inc in smart speaker sales in recent quarters.

Pixel phones, though, have been a tougher sell, garnering less than 1 percent of the global market by shipments in Google's first two years of trying, according to research firm Strategy Analytics, and launching with glitches.

The Pixel 3, priced at $799, and larger sibling Pixel 3 XL, priced at $899, mark Google's latest entries into a phone lineup it hopes will someday be as popular as Apple Inc's iPhone.

The new Pixel Slate tablet runs Google's beefier Chrome OS laptop operating system rather than Android and is priced at $599, putting it in competition with Apple's iPad Pro tablet series.

Shares of Alphabet barely moved on the release. Financial analysts said it is difficult evaluate Google´s hardware business as it is overshadowed by profits from search ads.

Google branched into hardware three years ago so that, like Apple, it could have full control of the performance of its applications and the revenue they generate. Other phone makers sometimes crowd out Google's apps with their own or take a share of ad revenue.

Expanding geographic distribution is likely to boost Pixel's fortunes. The Pixel 3 will launch in 10 countries, up from six for the Pixel 2 a year ago. New additions include France, Ireland, Japan and Taiwan.

Also helpful could be a new artificial intelligence tool sure to generate buzz among consumers. The software, launching in the United States only, answers phone calls, requests information about the nature of the call and shares it as text with the recipient.

""We´ve built the first phone that can answer the phone,"" Rick Osterloh, Google's senior vice president for hardware, told media on Tuesday.

Google shipped 2.53 million Pixel 2 and 2 XL devices through the nine months ended June 30, Strategy Analytics said. The first Pixel devices hit 2.4 million shipments in the nine months ended June 30, 2017, the firm said.

Limited adoption has reflected Google's hesitancy to go as wide and big in distributing and marketing the Pixel as Apple, which launched its last two iPhone line-ups in about 50 countries.

Going from a small experiment to a polished product that works in various languages and is backed by large sales, support and technical teams has been part of Google's challenge.

Last year's Pixel 2 arrived with bugs that prompted user complaints about unwanted noises during calls, a crashing camera app and an unexpected screen tint. Google doubled warranties to two years in response.

Google Assistant, the signature virtual helper feature on the Pixel, was available in six languages a year ago and now supports 16.

In turn, Google hosted 10 unveiling events across the world on Tuesday, including in New York, London, Paris, Tokyo and Singapore, spokesman Kay Oberbeck said.

Still, the Pixel 3 could see limited uptake in the United States as Google again signed an exclusive distribution deal with wireless carrier Verizon Communications Inc that means the device will get little marketing from other carriers.

Google said it would augment distribution by opening on Oct. 18 two temporary stores in popular neighborhoods of Chicago and New York and putting up displays at U.S. retailers B8ta and Goop.

Google's new smart speaker, which has a display to show visual responses to voice commands, mostly matches offerings from Amazon.com Inc and Facebook Inc.

But unlike its competitors, Google said its Home Hub, priced at $149, does not have a video conferencing camera.

The nod to privacy concerns comes as Google and other big U.S. tech companies try to bounce back from recent data breach scandals.

Amazon shipped 21.5 million smart speakers, including those with displays, in the year ended June 30, compared with 18.3 million for Google, according to research firm Canalys.

Google said in a blog post on Tuesday that it recently delivered some Google Home speakers within 10 minutes of ordering using drones from Alphabet's Project Wing.

Shares of speaker maker Sonos Inc were down 5.6 percent on Tuesday."
41,Apple undercover investigation into overcharging at Genius Bar repairs,Daily Mail UK,2018-10-09,0.557648,0.984085,"An undercover investigation showed video of an Apple Genius Bar employee in Canada telling a customer that the simple repair to his Apple computer would cost as much as a new computer. The National went undercover with a hidden camera to an Apple Store in Toronto to see what the employees would say about a laptop with a darkened screen. Despite the customer asking if the dark LCD can be fixed if water damage isn't the issue, the Genius Bar employee uses a turn of phrase, essentially saying regardless of if the screen is not damaged by water- they still need to fix the water damage- even if it is not impacting the performance

Rossman added that there were some indicator buttons that had showed there was water damage, but nothing like the Apple store employee had said which would necessitate buying an entirely new one. Additionally, The National heads to iFixit in California, which is another well known third party Apple repair shop. The investigation then returns to Toronto, where John Poole, the founder of Geekbench, who unearthed Apple's iPhone throttling of older devices, and discuss how once a new upgrade was installed customers were all experiencing slow-downs in their older iPhones.",https://www.dailymail.co.uk/news/article-6258083/Undercover-investigation-video-Apple-Genius-Bar-tells-customer-cost-fixing-new-laptop.html?ns_mchannel=rss&ito=1490&ns_campaign=1490,"An undercover investigation showed video of an Apple Genius Bar employee in Canada telling a customer that the simple repair to his Apple computer would cost as much as a new computer.

The National went undercover with a hidden camera to an Apple Store in Toronto to see what the employees would say about a laptop with a darkened screen. After the employee went into the back of the store to run a diagnostic he came back with a shocking price quote.

The employee said the most of the computer had been damaged with water, and therefore the customer would need to either spend $1,200 (USD $927) to fix it, or for around the same price, get a new one.

However, when the same computer was brought to a third party repair shop in New York, it took Luis Rossman at Rossman Repair Group under two-minutes to fix the darkened LCD screen by bending back a pin, and he says he would never have even charged someone for fixing it.

Despite the customer asking if the dark LCD can be fixed if water damage isn't the issue, the Genius Bar employee uses a turn of phrase, essentially saying regardless of if the screen is not damaged by water- they still need to fix the water damage- even if it is not impacting the performance

Rossman added that there were some indicator buttons that had showed there was water damage, but nothing like the Apple store employee had said which would necessitate buying an entirely new one.

Additionally, he said a computer could simply be in a damp room and end up with all of the water damage indicator buttons tagged as affected.

Apple issued a statement in response to the investigation saying their customers are best served by 'certified experts using genuine parts,' and denied grossly overestimating customers repair costs.

The investigation also delved into Apple's other 'controversial business practices including the battery/slowdown scandal.'

Additionally, The National heads to iFixit in California, which is another well known third party Apple repair shop.

There, they talk to Kyle Weins, who demonstrates the iPhone 8's battery which is glued in unnecessarily and also discussed Apple's proprietary pentalobe screw, while discussing the American Right to Repair legislation.

The investigation then returns to Toronto, where John Poole, the founder of Geekbench, who unearthed Apple's iPhone throttling of older devices, and discuss how once a new upgrade was installed customers were all experiencing slow-downs in their older iPhones.

Canadian consumer rights lawyer for Hagens Berman, Shana Scarlett, is also interviewed in California.

Scarlett was part of a class-action lawsuit against Apple, which won $450million for the company's breach of antitrust laws.

Additionally, The National delves into a Parliamentary Committee Hearing on the iPhone slowdown incident in March in Canada, where an Apple Canada lawyer came under fire.

MP Nathaniel Erskine-Smith repeatedly asks the Apple lawyer 'was the non-disclosure non-intentional or was it inadvertent?' Apple responded to say it was 'non-intentional'."
42,The top 10 books on Apple's iBooks-US,Daily Mail UK,2018-10-09,0.616482,0.705821,"The Fifth Risk by Michael Lewis - 9781324002659 - (W. W. Norton & Company)

9. Lethal White by Robert Galbraith - 9780316422741 - (Little, Brown and Company)

10. Juror #3 by James Patterson & Nancy Allen - 9780316470063 - (Little, Brown and Company)",https://www.dailymail.co.uk/wires/ap/article-6258417/The-10-books-Apples-iBooks-US.html?ns_mchannel=rss&ito=1490&ns_campaign=1490,"iBook charts for week ending October 7, 2018: (Rank, Book Title by Author Name, ISBN, Publisher :

3. Don't Let Go by Harlan Coben - 9780698411661 - (Penguin Publishing Group)

8. The Fifth Risk by Michael Lewis - 9781324002659 - (W. W. Norton & Company)

9. Lethal White by Robert Galbraith - 9780316422741 - (Little, Brown and Company)

10. Juror #3 by James Patterson & Nancy Allen - 9780316470063 - (Little, Brown and Company)"
43,Apple patents magnetic case that keeps phones safe if they are dropped,Daily Mail UK,2018-10-09,0.56031,0.889809,"The electromagnets would be added to the device alongside traditional magnets to provide an even stronger magnetic connection. 'Unfortunately, the fields produced by the permanent magnets are not always ideal and cannot be adapted to fit every particular situation,' Apple says in the patent. Electromagnets, meanwhile, can produce a 'substantially stronger magnetic field' than even the 'highest strength permanent magnets,' the firm added. Apple believes electromagnets would be particularly useful to prevent falling devices from breaking or smashing upon impact with the ground. 'Once corner of protective case impacts a hard surface the space between protective case and device forms a crush zone that reduces a rate at which force from the impact is imparted to device, thereby reducing a likelihood of damage,' Apple explained in the patent.",https://www.dailymail.co.uk/sciencetech/article-6258221/Apple-patents-case-uses-high-powered-magnets-iPads-iPhones-safe-theyre-dropped.html?ns_mchannel=rss&ito=1490&ns_campaign=1490,"Cracked screens could soon become a thing of the past.

Apple was awarded a patent for a case that could protect youriPad or iPhone in the midst of a fall.

The patent was filed in March of 2015, but was just made public on Tuesday.

In the document, titled 'Dynamic stabilized magnetic array,' Apple describes a hi-tech gadget that uses electromagnetics to connect devices and accessories to each other.

The electromagnets would be added to the device alongside traditional magnets to provide an even stronger magnetic connection.

'Unfortunately, the fields produced by the permanent magnets are not always ideal and cannot be adapted to fit every particular situation,' Apple says in the patent.

'Furthermore, a magnetic coupling created by permanent magnets may not be strong enough to withstand certain challenging working environments in which peak forces applied to the magnetic coupling exceed the forces provided by the magnetic attraction.'

Electromagnets, meanwhile, can produce a 'substantially stronger magnetic field' than even the 'highest strength permanent magnets,' the firm added.

Apple believes electromagnets would be particularly useful to prevent falling devices from breaking or smashing upon impact with the ground.

The patent describes how the electromagnets would be powered by a magnetic field sensor in the magnetic array.

If a fall is detected, a few of the electromagnets in the case deactivate, which causes the device to be dragged away from the side that is expected to crash into the floor.

'Once corner of protective case impacts a hard surface the space between protective case and device forms a crush zone that reduces a rate at which force from the impact is imparted to device, thereby reducing a likelihood of damage,' Apple explained in the patent.

'In some embodiments, power supplied to electromagnets and can be slowly reduced to further be controlled.

'This can be particularly effective once the established crush zone has flattened and no longer has any give left as it can allow even greater control over a rate of deceleration,' the firm added.

The patent primarily describes the case as being used to protect iPads, but it's likely that it could be used for iPhones too.

Such a device would build on Apple's Smart Cover for the iPad, which uses magnets to wake and put the iPad to sleep.

It's unclear if Apple will ever release a case that prevents shattered devices, as many patented devices never come to fruition, but it's an interesting idea nonetheless."
